,title,image_url,price
0,GOOACC - GRC-33 240PCS Bumper Retainer Clips Car Plastic Rivets Fasteners Push Retainer Kit Most Popular Sizes Auto Push Pin Rivets Set -Door Trim Panel Fender Clips for GM Ford Toyota Honda Chrysler,https://m.media-amazon.com/images/I/71rDWpcgQQL._AC_UL320_.jpg,12.14
1,"NOCO GENIUS1, 1A Smart Car Battery Charger, 6V and 12V Automotive Charger, Battery Maintainer, Trickle Charger, Float Charger and Desulfator for Motorcycle, ATV, Lithium and Deep Cycle Batteries",https://m.media-amazon.com/images/I/81xccMDEjkL._AC_UL320_.jpg,29.95
2,"LISEN 54W Car Phone Charger USB C, Cigarette Lighter Adapter, Car Accessories for iPhone, USB C Car Charger Adapter USBC Type C 12v, Fit for iPhone 16E 16 15 14 13 12 Samsung S25 Google iPad Android",https://m.media-amazon.com/images/I/71WuW-IcDLL._AC_UL320_.jpg,9.97
3,"FRAM Fresh Breeze Cabin Air Filter Replacement for Car Passenger Compartment w/Arm and Hammer Baking Soda, Easy Install, CF10285 for Toyota Vehicles , white",https://m.media-amazon.com/images/I/71RU5PwiLEL._AC_UL320_.jpg,9.87
4,"Rain-X 810165 Latitude 2-In-1 Water Repellent Wiper Blades, 22 Inch Windshield Wipers (Pack Of 2), Automotive Replacement Windshield Wiper Blades With Patented Rain-X Water Repellency Formula",https://m.media-amazon.com/images/I/71ZDqv1L5aL._AC_UL320_.jpg,34.99
5,"NOCO GCP1 15A AC Port Plug, 125V Power Inlet Socket, and Waterproof Electrical Outlet Receptacle Box with 16-Inch Integrated Outdoor Extension Cord",https://m.media-amazon.com/images/I/710i8peBqTL._AC_UL320_.jpg,29.15
6,"FRAM Ultra Synthetic Automotive Replacement Oil Filter, Designed for Synthetic Oil Changes Lasting up to 20k Miles, XG7317 with SureGrip (Pack of 1)",https://m.media-amazon.com/images/I/81Sep0UQnTL._AC_UL320_.jpg,8.97
7,"JOREST 300Pcs Car Fuse Assortment Kit, 160 Mini Blade Fuses Automotive + 90 Standard Auto Fuses + 50 Micro Fuse + 1 Puller – for Car/RV/Truck/Motorcycle(2Amp 3A 5A 7.5A 10A 15A 20A 25A 30A 35A 40A)",https://m.media-amazon.com/images/I/91v4r9LueAL._AC_UL320_.jpg,12.74
8,EPAuto CP285 (CF10285) Premium Cabin Air Filter includes Activated Carbon,https://m.media-amazon.com/images/I/81FOMPvcd7L._AC_UL320_.jpg,10.17
9,Motorcraft FL-500S Oil Filter,https://m.media-amazon.com/images/I/61e4TlTuhuL._AC_UL320_.jpg,8.44
10,"Energizer Jumper Cables for Car Battery, Heavy Duty Automotive Booster Cables for Jump Starting Dead or Weak Batteries with Carrying Bag Included (16-Feet (6-Gauge)",https://m.media-amazon.com/images/I/71NQlEz63kL._AC_UL320_.jpg,19.96
11,"FRAM Extra Guard PH7317, 10K Mile Change Automotive Replacement Interval Spin-On Engine Oil Filter for Select Vehicle Models",https://m.media-amazon.com/images/I/71w0LPOPQAL._AC_UL320_.jpg,4.12
12,"LivTee Blind Spot Mirror, 2"" Round HD Glass Frameless Convex Rear View Mirrors Exterior Accessories with Wide Angle Adjustable Stick for Car SUV and Trucks, Pack of 2",https://m.media-amazon.com/images/I/71G7O1ZhS4L._AC_UL320_.jpg,6.99
13,"3M Super-Strength Molding Tape, 1/2 in x 15 ft, High Strength Double-Sided Adhesive, Permanently Attaches Side Moldings, Trim and Emblems to Interior and Exterior of Vehicles (03614)",https://m.media-amazon.com/images/I/81MOwHuKglL._AC_UL320_.jpg,10.61
14,"Upgraded Car Center Console Cover,Microfiber Leather Car Armrest Cover Cushion with 2 Storage Bags,Universal Car Armrest Storage Box Car Interior Accessories for Most Vehicles (Black)",https://m.media-amazon.com/images/I/71Ebc3VTE1L._AC_UL320_.jpg,10.07
15,"Puroma Cabin Air Filter with Activated Carbon, Replacement for CP134, CF10134, Honda & Acura, Civic, CR-V, Odyssey, CSX, ILX, MDX, RDX, AT134 (1 pc)",https://m.media-amazon.com/images/I/81yirRiG9zL._AC_UL320_.jpg,8.37
16,"Rain-X 820149 WeatherBeater Wiper Blades, 22"" Windshield Wipers (Pack of 2), Automotive Replacement Windshield Wiper Blades That Meet Or Exceed OEM Quality And Durability",https://m.media-amazon.com/images/I/71g+-iAW9YL._AC_UL320_.jpg,24.92
17,"Car Cigarette Lighter Splitter, 2-Socket Cigarette Lighter Adapter with LED Voltmeter, Dual USB QC3.0 Type-C 20W PD Fast Car Charger, 12V/24V Car Splitter Adapter for Smart Phone GPS Dash Cam",https://m.media-amazon.com/images/I/414nbLZnJiL._AC_UL320_.jpg,7.19
18,"BLUEAIR Blue Pure 411 Auto, 411, 411+ Genuine Replacement Filter, Particle and Activated Carbon, fits Blue Pure 411 Auto, 411 and 411+ Air Purifiers",https://m.media-amazon.com/images/I/61A25-Ve2dL._AC_UL320_.jpg,23.49
19,"NEXPEAK NC201 10-Amp Battery Charger, Smart Trickle Charger 12V 24V Car Battery Charger Fully Automatic Maintainer Desulfator w/Temp Compensation for Car Truck Lawn Mower Boat Marine Batteries",https://m.media-amazon.com/images/I/71oulu3eNiL._AC_UL320_.jpg,22.49
20,"JOYTUTUS Rear View Mirror, Universal 11.81 Inch Panoramic Convex Rearview Mirror, Interior Clip-on Wide Angle Rear View Mirror to Reduce Blind Spot Effectively for Car SUV Trucks -Clear",https://m.media-amazon.com/images/I/71T2TGj4XUL._AC_UL320_.jpg,8.49
21,"FRAM Fresh Breeze Cabin Air Filter Replacement for Car Passenger Compartment w/ Arm and Hammer Baking Soda, Easy Install, CF10134 for Honda Vehicles, white",https://m.media-amazon.com/images/I/71XLF2lz3hL._AC_UL320_.jpg,12.0
22,"MOTIUM OEM QUALITY Premium All-Season Windshield Wiper Blades (22""+22"" pair for front windshield)…",https://m.media-amazon.com/images/I/61oYNby8NUL._AC_UL320_.jpg,14.44
23,"Battery Tender Junior 12V, 750mA Charger and Maintainer: Automatic 12V Powersports for Motorcycle, ATVs, and More - Smarter Than a Trickle Charger - 021-0123",https://m.media-amazon.com/images/I/61nddgtbkaL._AC_UL320_.jpg,34.95
